[
  {"id":"aiot-q-0001","topic":"ai-basic","src":"guide","ref":"指引 3-1 1","q":"關於機器學習（Machine Learning）在AIoT 資料分析中的應用範式，下列敘述何者正確？","opts":["監督式學習（Supervised Learning）不需依賴標籤資料，適合用於未知故障型態的探索","非監督式學習（Unsupervised Learning）常利用資料分群（Clustering）技術，將相似的設備運作資料自動歸類","強化學習（Reinforcement Learning）的主要目標是進行靜態影像的瑕疵檢測（Automated Optical Inspection, AOI）","迴歸（Regression）屬於非監督式學習的一種，主要用於將資料進行離散類別的區分"],"ans":1,"exp":"(A) 錯誤。監督式學習必須依賴「特徵與對應的標籤（Label）」才能進行訓練，無法處理無標籤的未知型態。 (B) 正確。非監督式學習無需標籤，可透過演算法找出資料內部的結構與群集特性，台灣教科書稱之為「分群」。 (C) 錯誤。影像瑕疵檢測（AOI）通常使用監督式學習中的卷積神經網路（CNN）；強化學習主要用於動態控制決策（如空調節能控制）。 (D) 錯誤。迴歸屬於監督式學習，且輸出為「連續數值」（如溫度、壽命預測），而非離散類別（那是分類Classification）。"},
  {"id":"aiot-q-0002","topic":"ai-basic","src":"guide","ref":"指引 3-1 2","q":"在處理AIoT 感測器產生的時間序列資料（Time-series Data），如馬達連續震動波形或電流趨勢時，下列何種神經網路模型架構最為合適？","opts":["卷積神經網路（CNN）","循環神經網路（RNN/LSTM）","生成對抗網路（GAN）","隨機森林（Random Forest）"],"ans":1,"exp":"(A) 錯誤。CNN 擅長處理具有空間結構的資料（如影像），雖也可用於一維時間序列（1D-CNN），但在教學與典型應用中，RNN/LSTM 更具代表性。 (B) 正確。RNN 與LSTM 具備「記憶」機制，能捕捉前後時間點的關聯性，最適合時序資料。 (C) 錯誤。GAN 主要用於生成新資料（如生成逼真影像），而非用於時序訊號的分析與預測。 (D) 錯誤。隨機森林是傳統機器學習演算法，不屬於深度學習（類神經網路）架構。"},
  {"id":"aiot-q-0003","topic":"ai-basic","src":"guide","ref":"指引 3-1 3","q":"在邊緣運算（Edge AI）架構中，為了讓神經網路模型能部署在資源受限的微控制器（MCU）上，通常會採用「量化（Quantization）」技術。關於此技術的敘述，下列何者正確？","opts":["將模型參數由高精度浮點數（FP32）轉換為低精度整數（INT8），以降低記憶體佔用","透過增加神經網路的層數，來提升模型在邊緣端的推論準確度","將模型切割成多個部分，分別在不同的雲端伺服器上執行","是一種將類比訊號轉換為數位訊號的硬體電路技術"],"ans":0,"exp":"(A) 正確。量化是透過降低數值精度來換取更小的模型體積與更快的運速度，適合邊緣端（Edge）。 (B) 錯誤。增加層數會增加運算量與體積，不符合邊緣裝置輕量化的需求。 (C) 錯誤。這是「模型平行（Model Parallelism）」或分散式運算的概念，並非量化。 (D) 錯誤。這是訊號處理中的「類比數位轉換（ADC）」，與AI 模型的權重量化不同。"},
  {"id":"aiot-q-0004","topic":"ai-basic","src":"guide","ref":"指引 3-1 4","q":"關於神經網路處理器（Neural Processing Unit, NPU）在AIoT 邊緣裝置中的角色與特性，下列敘述何者正確？","opts":["NPU 可完全取代 CPU，負責作業系統與 I/O 等通用運算","NPU 專注於推論（Forward Propagation），省去訓練所需的反向傳播邏輯，因此能效極高","雲端訓練大型模型時，通常直接使用邊緣裝置上的 NPU 進行運算","NPU 執行 INT8 量化模型時，比浮點運算更耗電也更慢"],"ans":1,"exp":"(A) 錯誤。NPU 是協同處理器，負責 AI 加速，通用運算（OS、I/O）仍由 CPU 負責。(B) 正確。NPU 專注於推論，移除訓練所需的複雜反向傳播邏輯，因此能效極高。(C) 錯誤。雲端訓練通常使用高算力的 GPU 或 TPU；邊緣 NPU 的運算力不足以支撐訓練。(D) 錯誤。NPU 的優勢正是執行 INT8 量化模型，比浮點運算更省電且快速。"},
  {"id":"aiot-q-0005","topic":"ai-basic","src":"guide","ref":"指引 3-1 5","q":"為了降低AIoT 系統的隱私風險，應遵循「由設計起始的隱私（Privacy by Design, PbD）」原則。下列哪項措施最符合此原則在「邊緣運算」中的實踐？","opts":["將攝影機拍攝的所有原始畫面無條件上傳至雲端儲存，以備不時之需","僅依賴雲端伺服器的防火牆進行防護，終端裝置不需處理資安","在邊緣端即進行資料去識別化（如僅傳送特徵值或骨架資訊），避免原始敏感個資外流","要求所有使用者在使用服務前，必須簽署放棄隱私權同意書"],"ans":2,"exp":"(A) 錯誤。上傳原始畫面會增加傳輸過程被攔截的風險，且雲端儲存亦有洩漏風險，不符最小化原則。 (B) 錯誤。AIoT 強調端對端防護，邊緣裝置（Edge）往往是駭客入侵的破口，不能只靠雲端。 (C) 正確。PbD 強調在系統架構設計時就納入隱私。數據「不離地」或「去識別化後才上傳」是核心實踐。 (D) 錯誤。這屬於法律免責手段，並非技術架構上的「設計起始（by Design）」保護措施。"},
  {"id":"aiot-q-0006","topic":"aiot-cases","src":"guide","ref":"指引 3-2 1","q":"在智慧工廠的「預測性維護（Predictive Maintenance, PdM）」應用中，關於AI 模型任務的分類，下列敘述何者正確？","opts":["「故障診斷（Diagnosis）」屬於迴歸任務，用於計算設備的運轉時數","「健康預測（Prognosis）」屬於分類任務，用於判斷設備是否故障","「故障診斷」用於判斷設備當前狀態（如正常/異常），屬於分類任務","「健康預測」主要依賴非監督式學習，不需參考歷史故障資料"],"ans":2,"exp":"(A) 錯誤。故障診斷是判斷「類別」（哪種故障），屬於分類（Classification）。 (B) 錯誤。健康預測是推估「剩餘壽命（Remaining Useful Life, RUL）」，輸出為連續時間數值，屬於迴歸（Regression）。 (C) 正確。診斷即是分類當下的狀態。 (D) 錯誤。健康預測通常需要歷史的衰退數據來訓練迴歸模型，通常是監督式學習。"},
  {"id":"aiot-q-0007","topic":"aiot-cases","src":"guide","ref":"指引 3-2 2","q":"關於「感測融合（Sensor Fusion）」技術在AIoT 系統中的主要效益，下列敘述何者正確？","opts":["目的是降低硬體成本，減少感測器的使用數量","透過整合多種不同類型的感測器（如影像加光達），提升系統在複雜環境下的強健性（Robustness）","只能在雲端伺服器上執行，無法在邊緣裝置上運作","會導致資料衝突，降低系統判斷的準確度"],"ans":1,"exp":"(A) 錯誤。感測融合通常需要更多或多種感測器，硬體成本可能增加，但換取的是可靠度。 (B) 正確。互補不同感測器的盲點（例如光達補強影像在暗處的不足），增加系統強健性（台灣學術用語，對應Robustness）。 (C) 錯誤。感測融合常在邊緣端（如自駕車的車載電腦）即時執行。 (D) 錯誤。融合演算法（如Kalman Filter 或AI 模型）的目的正是解決衝突，提升準確度。"},
  {"id":"aiot-q-0008","topic":"aiot-cases","src":"guide","ref":"指引 3-2 3","q":"某智慧農業場域需在大面積溫室佈署溫濕度監測系統，考量感測器需電池供電且傳輸距離遠（數公里），最適合採用下列何種通訊技術與AI 架構？","opts":["使用Wi-Fi 傳輸高解析度影像，並在感測器端進行模型訓練","使用低功耗廣域網路（Low-Power Wide-Area Network, LPWAN）（如LoRa）傳輸環境數值，並採「端雲協作」在雲端進行趨勢分析","使用NFC 進行近場資料讀取，並由人工抄寫數據","使用5G 毫米波進行超低延遲控制，不需考量功耗"],"ans":1,"exp":"(A) 錯誤。Wi-Fi 耗電高且傳輸距離短，不適合大面積農業；感測器端（End Node）通常無能力進行訓練。 (B) 正確。LoRa/Sigfox 具備長距離、低功耗特性，適合傳輸量小的溫濕度資料，複雜分析則交由雲端。 (C) 錯誤。NFC 距離僅數公分，無法達成自動化大面積監測。 (D) 錯誤。5G 基地台建置成本高且終端耗電，非單純環境監測的首選。"},
  {"id":"aiot-q-0009","topic":"ind-std","src":"guide","ref":"指引 3-2 4","q":"在智慧工廠中，為了讓AI 系統能讀取來自不同廠牌可程式邏輯控制器（Programmable Logic Controller, PLC ）的異質數據，通常會透過閘道器（Gateway）將資料轉換為下列何種工業標準通訊架構？","opts":["HTTP","OPC UA（Open Platform Communications Unified Architecture）","BLE（Bluetooth Low Energy）","USB 3.0"],"ans":1,"exp":"(A) 錯誤。HTTP 是網際網路應用層協定，雖通用但非工業底層設備（如PLC）資料交換的首選標準格式，且缺乏工業所需的時效性與語意描述。 (B) 正確。OPC UA 是工業4.0 架構中解決跨平台、跨廠牌設備互通性的標準協定，具備統一的資訊模型，方便上層AI 系統讀取與分析。 (C) 錯誤。BLE 是短距離無線通訊技術，主要用於消費電子或簡單感測器，並非工業控制器間資料交換的標準架構。 (D) 錯誤。USB 是實體傳輸介面，無法解決不同廠牌PLC 內部暫存器定義與通訊邏輯不一致的問題。"},
  {"id":"aiot-q-0010","topic":"aiot-cases","src":"guide","ref":"指引 3-2 5","q":"AIoT 系統規劃需考量「四位一體循環」，下列針對各層級功能的描述，何者正確？","opts":["感知端（Input）：負責執行複雜的深度學習模型訓練與權重更新","通訊端（Transport）：僅負責資料加密，不負責資料傳輸","智慧端（AI/Process）：負責進行資料分析、即時判斷（Judgment）或趨勢預測（Prediction）","安全端（Security）：指的就是在工廠門口設置保全人員，與資訊系統無關"],"ans":2,"exp":"(A) 錯誤。感知端（Sensor）負責擷取物理訊號，通常無能力進行模型訓練。 (B) 錯誤。通訊端負責將資料從端點傳輸到邊緣或雲端（如LoRa, 5G）。 (C) 正確。智慧端是AI 演算法發揮作用的地方，將資料轉化為決策。 (D) 錯誤。安全端指資訊安全，如資料加密、身分認證，非實體保全。"},
  {"id":"aiot-q-0011","topic":"iot-arch","src":"guide","ref":"指引 4-1 1","q":"下列哪一項是物聯網感測器的主要工作原理？","opts":["收集與傳輸數據","存儲數據與執行複雜的計算任務","控制外部設備","建立虛擬現實體驗"],"ans":0,"exp":"物聯網感測器的任務是把環境中的物理量（溫度、光線、振動等）轉成訊號並回傳，也就是「收集與傳輸數據」；儲存與複雜運算由閘道器、邊緣或雲端負責，控制外部設備是致動器（Actuator）的工作。"},
  {"id":"aiot-q-0012","topic":"iot-arch","src":"guide","ref":"指引 4-1 2","q":"下列哪一種「不」是智慧醫療中使用物聯網應用的例子？","opts":["智慧控溫器","自動駕駛汽車","穿戴裝置","遠距照護"],"ans":1,"exp":"智慧控溫器（監測病房或病患環境溫度）、穿戴裝置（量測心率、血氧）與遠距照護都是智慧醫療的物聯網應用；自動駕駛汽車屬於智慧交通。"},
  {"id":"aiot-q-0013","topic":"iot-arch","src":"guide","ref":"指引 4-1 3","q":"DHT11 屬於下列哪一種感測器？","opts":["光學感測器","音頻感測器","溫度和濕度感測器","加速度感測器"],"ans":2,"exp":"DHT11 是常見的低成本數位溫濕度感測器模組，同時量測溫度與相對濕度，以單線數位訊號輸出，常用於 Arduino、樹莓派等開發板的環境監測。"},
  {"id":"aiot-q-0014","topic":"iot-arch","src":"guide","ref":"指引 4-1 4","q":"下列哪一種感測器可用於監控居家中的瓦斯漏氣？","opts":["壓力感測器","光學感測器","溫度和濕度感測器","氣體感測器"],"ans":3,"exp":"瓦斯是一種無色、無味、易燃的氣體，透過氣體感測器可以檢測環境中的瓦斯濃度。當瓦斯漏氣時，氣體感測器會檢測到異常的瓦斯濃度，並發出聲音或發送警報訊息，提醒居民可能存在瓦斯漏氣問題。居民可以根據警報訊息採取相應的應對措施，例如通風、關閉瓦斯閥門、撤離房屋等。"},
  {"id":"aiot-q-0015","topic":"iot-arch","src":"guide","ref":"指引 4-1 5","q":"在工業環境中使用IoT 感測器的關鍵優勢，下列敘述何者「不」正確？","opts":["提高生產力和效率","可透過感測器數據收集，更加掌握製程的情況","可以透過感測器偵測設備的振動與溫度，預測產品的品質","對於設備維護的時間，仍無法預測"],"ans":3,"exp":"透過感測器對設備的數據收集，可以提早預測設備的維護時間，並使生產的預測能更精準。"},
  {"id":"aiot-q-0016","topic":"iot-arch","src":"guide","ref":"指引 4-1 6","q":"下列哪一項物聯網應用，「不」會使用到電子羅盤和加速度感測器？","opts":["智慧國防之無人機海巡搜索","智慧休憩之登山客戶外個人導航","智慧交通之無人車慣性導航","智慧家庭之室內燈光控制"],"ans":3,"exp":"電子羅盤（量測方位）與加速度感測器（量測加速度、姿態）用於需要定位與導航的移動載具，如無人機、登山導航、無人車慣性導航；室內燈光控制只需光感測器或人體感測器，用不到這兩種感測器。"},
  {"id":"aiot-q-0017","topic":"iot-arch","src":"guide","ref":"指引 4-1 7","q":"對於感測器的使用，下列哪一項「不」正確？","opts":["可以使用超音波感測器量測噪音分貝數","可以使用電子羅盤偵測無人機的飛行方向","可以使用三軸加速度計偵測居家老人是否跌倒","可以利用陀螺儀偵測無人機是否傾斜"],"ans":0,"exp":"超音波感測器是用來量測距離，不是偵測音量大小。"},
  {"id":"aiot-q-0018","topic":"iot-arch","src":"guide","ref":"指引 4-1 8","q":"下列哪一種感測器可用於監控智慧城市道路旁垃圾桶的填滿程度以進行垃圾車行進路線的規劃？","opts":["壓力感測器","超音波感測器","GPS 定位系統","加速度計"],"ans":1,"exp":"在垃圾桶蓋內側裝置超音波感測器，可測量到垃圾桶剩餘空間（即垃圾的填滿程度），進而進行垃圾車行進路線規劃。"},
  {"id":"aiot-q-0019","topic":"iot-arch","src":"guide","ref":"指引 4-1 9","q":"關於物聯網的感知層，下列敘述何者「不」正確？","opts":["負責感測和收集資料的層級","感測元件應各自運作，不需要兼顧感測器之間溝通及資料交換","透過各種感應器、設備或技術來收集環境中的物理或生理信號","主要包括無線射頻識別（RFID）技術、感測技術及控制技術等"],"ans":1,"exp":"很多應用場景需要感測器彼此間互相溝通，例如訪客按下門鈴後，會通知攝影機開始進行人臉辨識與錄影，此時兩個感測元件彼此間會進行資料交換，因此選項B 是錯誤的。"},
  {"id":"aiot-q-0020","topic":"iot-arch","src":"guide","ref":"指引 4-1 10","q":"「智慧停車場系統」中感測器技術應用的描述，下列何者正確？","opts":["紅外線感測器可以透過檢測車輛的熱能分佈來實時追蹤特定會員車輛行進路徑，並進行車輛流量分析","使用氣壓感測器來檢測車位上方的壓力變化，當車輛進入或離開車位時，根據壓力變化更新車位使用狀態","超音波感測器可用於檢測車輛進出車位時的動態距離，幫助停車場管理系統自動記錄停車時間與車位使用狀態","結合光纖感測技術，透過感應車輛輪胎的重量分佈來精確定位車輛，並即時傳輸數據到停車場管理平台"],"ans":2,"exp":"(A) 紅外線感測器主要用於檢測物體的溫度和熱能分佈，但不常用於追蹤車輛的路徑或分析流量。車輛流量分析更多依賴於影像或雷達技術。 (B) 氣壓感測器通常應用於環境氣壓測量，並不適合用來檢測車位壓力變化，停車場中多使用超音波或雷達來檢測車輛存在。 (C) 超音波感測器是智慧停車場中常見的技術，透過發射聲波並接收回波來檢測車輛與感測器之間的距離，判斷車位是否被占用。 (D) 光纖感測技術主要應用於通訊和特殊工業監測，並不常用於智慧停車場系統的車輛檢測與定位。"},
  {"id":"aiot-q-0021","topic":"iot-protocol","src":"guide","ref":"指引 4-2 1","q":"下列哪一種網路協定可用於物聯網低功耗設備之間的通訊？","opts":["HTTP","FTP","MQTT","SMTP"],"ans":2,"exp":"MQTT（Message Queuing Telemetry Transport）是一種輕量級的、開放源碼的消息協議，通常用於物聯網設備之間的通信。並且針對低頻寬和不穩定的網路連接進行了優化。這意味著它可以在低功耗設備之間進行通信，同時保持良好的連接性。"},
  {"id":"aiot-q-0022","topic":"iot-protocol","src":"guide","ref":"指引 4-2 2","q":"關於第五代行動通訊（5G）的技術或特性，下列敘述哪一項「不」正確？","opts":["5G 的速度比4G 快","適合需要高帶寬和低延遲連接的應用程序","可以在同一時間提供更多的用戶使用基地台","是一種低功耗、長距離無線通訊技術"],"ans":3,"exp":"5G 更適合高頻寬、低延遲、高速率的應用，以及高密度、高速度的移動設備通訊。在固定速率下，可提供更多的用戶來使用基地台。5G 在傳輸速率、容量、連接密度、可靠性等方面都有很大的提升，但是相對地需要更多的功率和較短的通訊距離。"},
  {"id":"aiot-q-0023","topic":"iot-protocol","src":"guide","ref":"指引 4-2 3","q":"MQTT 通訊協定定義了多種傳輸品質保證層級（QoS Level），下列哪一項層級「不」保證資料會送達目的端？","opts":["Level 0","Level 1","Level 2","Level 3"],"ans":0,"exp":"MQTT 的 QoS 只有 0、1、2 三個等級：QoS 0 最多送一次（At most once），不保證送達；QoS 1 至少送一次（At least once），可能重複；QoS 2 恰好送一次（Exactly once）。沒有 Level 3。"},
  {"id":"aiot-q-0024","topic":"iot-protocol","src":"guide","ref":"指引 4-2 4","q":"CoAP 是一種類似輕量級HTTP 並可適用於物聯網通訊的協定，此協定「不」支援下列哪一項請求方式來實現物聯網設備間的通訊？","opts":["GET","QUERY","POST","PUT"],"ans":1,"exp":"CoAP 仿照 HTTP 的 REST 設計，提供 GET、POST、PUT、DELETE 四種請求方法，但架在 UDP 上、標頭精簡，適合資源受限的裝置；沒有 QUERY 這種方法。"},
  {"id":"aiot-q-0025","topic":"iot-protocol","src":"guide","ref":"指引 4-2 5","q":"設計一個智慧保全系統讓用戶除了可以透過智慧手機觀察家中長者的起居狀況並可進行線上通話。下列哪一種網路傳輸協定「最」適合此應用情境？","opts":["HTTP","WebSocket","CoAP","MQTT"],"ans":1,"exp":"觀看即時影像並進行線上通話，需要瀏覽器／手機與伺服器之間持續、雙向、低延遲的通訊，WebSocket 建立連線後可雙向即時傳送資料，最合適。HTTP 是一問一答的請求回應模式；CoAP、MQTT 主要傳輸小量感測資料。"},
  {"id":"aiot-q-0026","topic":"iot-protocol","src":"guide","ref":"指引 4-2 6","q":"關於MQTT，下列敘述何者「不」正確？","opts":["發佈者無法知道有多少訂閱者訂閱資料","以Client-Server 架構而言，發佈者為client 端而訂閱者也是client 端","發佈者無法要求Broker 保留一份最新訊息給新加入的訂閱者","MQTT 使用TCP 協定傳輸資料"],"ans":2,"exp":"根據MQTT 協定定義，發佈者可以透過Retained Message 要求Broker 保留一份最新訊息給新加入的訂閱者。"},